{
  "@context": "https://linked.art/ns/v1/linked-art.json",
  "id": "https://linked.art/example/text/4",
  "type": "LinguisticObject",
  "_label": "Example 10 page Article",
  "classified_as": [
    {
      "id": "http://vocab.getty.edu/aat/300048715",
      "type": "Type",
      "_label": "Article"
    }
  ],
  "referred_to_by": [
    {
      "type": "LinguisticObject",
      "classified_as": [
        {
          "id": "http://vocab.getty.edu/aat/300435440",
          "type": "Type",
          "_label": "Pagination Statement",
          "classified_as": [
            {
              "id": "http://vocab.getty.edu/aat/300418049",
              "type": "Type",
              "_label": "Brief Text"
            }
          ]
        }
      ],
      "content": "125-135"
    }
  ]
}